{
  "$schema": "http://json-schema.org/draft-07/schema#",
  "type": "object",
  "title": "realtimeSensors Configuration Schema",
  "description": "Auto-generated schema for realtimeSensors configuration",
  "_generated": "2025-09-27T07:05:06.938Z",
  "_generator": "componentSchemaGenerator v1.0.0",
  "_version": "0.1.0",
  "properties": {
    "component": {
      "type": "object",
      "properties": {
        "name": {
          "type": "string",
          "minLength": 1
        },
        "displayName": {
          "type": "string",
          "minLength": 1
        },
        "version": {
          "type": "string",
          "minLength": 1
        },
        "description": {
          "type": "string",
          "minLength": 1,
          "maxLength": 1000
        },
        "author": {
          "type": "string",
          "minLength": 1
        },
        "category": {
          "type": "string",
          "minLength": 1
        },
        "tags": {
          "type": "array",
          "items": {
            "type": "string",
            "minLength": 1
          },
          "minItems": 0
        },
        "dependencies": {
          "type": "object",
          "properties": {
            "vue": {
              "type": "string",
              "minLength": 1
            },
            "securityService": {
              "type": "string",
              "minLength": 1
            },
            "i18nService": {
              "type": "string",
              "minLength": 1
            }
          },
          "additionalProperties": true
        },
        "permissions": {
          "type": "array",
          "items": {
            "type": "string",
            "minLength": 1
          },
          "minItems": 0
        },
        "roles": {
          "type": "array",
          "items": {
            "type": "string",
            "minLength": 1
          },
          "minItems": 0
        }
      },
      "additionalProperties": true
    },
    "ui": {
      "type": "object",
      "properties": {
        "responsive": {
          "type": "object",
          "properties": {
            "breakpoints": {
              "type": "object",
              "properties": {
                "mobile": {
                  "type": "string",
                  "minLength": 1
                },
                "tablet": {
                  "type": "string",
                  "minLength": 1
                },
                "desktop": {
                  "type": "string",
                  "minLength": 1
                },
                "industrial_79": {
                  "type": "string",
                  "minLength": 1
                }
              },
              "additionalProperties": true
            },
            "layout": {
              "type": "string",
              "minLength": 1
            },
            "orientation": {
              "type": "string",
              "minLength": 1
            }
          },
          "additionalProperties": true
        },
        "display": {
          "type": "object",
          "properties": {
            "primaryColor": {
              "type": "string",
              "pattern": "^#[0-9a-fA-F]{6}$",
              "description": "Hex color code",
              "minLength": 1
            },
            "backgroundGradient": {
              "type": "string",
              "minLength": 1
            },
            "cardShadow": {
              "type": "string",
              "minLength": 1
            },
            "borderRadius": {
              "type": "string",
              "minLength": 1
            },
            "fontFamily": {
              "type": "string",
              "minLength": 1
            }
          },
          "additionalProperties": true
        },
        "animation": {
          "type": "object",
          "properties": {
            "enableTransitions": {
              "type": "boolean"
            },
            "pulseAnimation": {
              "type": "string",
              "minLength": 1
            },
            "hoverEffects": {
              "type": "boolean"
            },
            "alertBlink": {
              "type": "string",
              "minLength": 1
            }
          },
          "additionalProperties": true
        },
        "touch": {
          "type": "object",
          "properties": {
            "minTouchTarget": {
              "type": "string",
              "minLength": 1
            },
            "swipeEnabled": {
              "type": "boolean"
            },
            "hapticFeedback": {
              "type": "boolean"
            }
          },
          "additionalProperties": true
        }
      },
      "additionalProperties": true
    },
    "data": {
      "type": "object",
      "properties": {
        "defaults": {
          "type": "object",
          "properties": {
            "refreshRate": {
              "type": "number",
              "minimum": 0
            },
            "alertsEnabled": {
              "type": "boolean"
            },
            "recordingEnabled": {
              "type": "boolean"
            },
            "maxHistoryPoints": {
              "type": "number",
              "minimum": 0
            },
            "sensorCount": {
              "type": "number",
              "minimum": 0
            }
          },
          "additionalProperties": true
        },
        "sensors": {
          "type": "object",
          "properties": {
            "defaultTypes": {
              "type": "array",
              "items": {
                "type": "string",
                "minLength": 1
              },
              "minItems": 0
            },
            "statusLevels": {
              "type": "array",
              "items": {
                "type": "string",
                "minLength": 1
              },
              "minItems": 0
            },
            "trendTypes": {
              "type": "array",
              "items": {
                "type": "string",
                "minLength": 1
              },
              "minItems": 0
            },
            "refreshRates": {
              "type": "array",
              "items": {
                "type": "number",
                "minimum": 0
              },
              "minItems": 0
            }
          },
          "additionalProperties": true
        },
        "validation": {
          "type": "object",
          "properties": {
            "valueRange": {
              "type": "object",
              "properties": {
                "min": {
                  "type": "number"
                },
                "max": {
                  "type": "number",
                  "minimum": 0
                }
              },
              "additionalProperties": true
            },
            "refreshRateRange": {
              "type": "object",
              "properties": {
                "min": {
                  "type": "number",
                  "minimum": 0
                },
                "max": {
                  "type": "number",
                  "minimum": 0
                }
              },
              "additionalProperties": true
            }
          },
          "additionalProperties": true
        }
      },
      "additionalProperties": true
    },
    "security": {
      "type": "object",
      "properties": {
        "auditEvents": {
          "type": "array",
          "items": {
            "type": "string",
            "minLength": 1
          },
          "minItems": 0
        },
        "inputSanitization": {
          "type": "boolean"
        },
        "dataValidation": {
          "type": "boolean"
        },
        "sessionTracking": {
          "type": "boolean"
        },
        "exportLimits": {
          "type": "object",
          "properties": {
            "maxExportSize": {
              "type": "string",
              "minLength": 1
            },
            "dailyExportLimit": {
              "type": "number",
              "minimum": 1,
              "maximum": 65535
            }
          },
          "additionalProperties": true
        }
      },
      "additionalProperties": true
    },
    "performance": {
      "type": "object",
      "properties": {
        "caching": {
          "type": "object",
          "properties": {
            "enabled": {
              "type": "boolean"
            },
            "cacheDuration": {
              "type": "number",
              "minimum": 0
            },
            "maxCacheSize": {
              "type": "string",
              "minLength": 1
            }
          },
          "additionalProperties": true
        },
        "optimization": {
          "type": "object",
          "properties": {
            "lazyLoading": {
              "type": "boolean"
            },
            "componentBundling": {
              "type": "boolean"
            },
            "assetOptimization": {
              "type": "boolean"
            }
          },
          "additionalProperties": true
        },
        "monitoring": {
          "type": "object",
          "properties": {
            "memoryUsage": {
              "type": "boolean"
            },
            "renderTime": {
              "type": "boolean"
            },
            "updateFrequency": {
              "type": "boolean"
            }
          },
          "additionalProperties": true
        }
      },
      "additionalProperties": true
    },
    "accessibility": {
      "type": "object",
      "properties": {
        "ariaLabels": {
          "type": "boolean"
        },
        "keyboardNavigation": {
          "type": "boolean"
        },
        "screenReaderSupport": {
          "type": "boolean"
        },
        "highContrast": {
          "type": "boolean"
        },
        "focusManagement": {
          "type": "boolean"
        },
        "semanticElements": {
          "type": "boolean"
        }
      },
      "additionalProperties": true
    },
    "i18n": {
      "type": "object",
      "properties": {
        "defaultLanguage": {
          "type": "string",
          "minLength": 1
        },
        "supportedLanguages": {
          "type": "array",
          "items": {
            "type": "string",
            "minLength": 1
          },
          "minItems": 0
        },
        "translationKeys": {
          "type": "object",
          "properties": {
            "title": {
              "type": "string",
              "minLength": 1
            },
            "controls": {
              "type": "string",
              "minLength": 1
            },
            "status": {
              "type": "string",
              "minLength": 1
            },
            "alerts": {
              "type": "string",
              "minLength": 1
            },
            "export": {
              "type": "string",
              "minLength": 1
            },
            "recording": {
              "type": "string",
              "minLength": 1
            }
          },
          "additionalProperties": true
        },
        "dateTimeFormat": {
          "type": "object",
          "properties": {
            "pl": {
              "type": "string",
              "minLength": 1
            },
            "en": {
              "type": "string",
              "minLength": 1
            },
            "de": {
              "type": "string",
              "minLength": 1
            }
          },
          "additionalProperties": true
        }
      },
      "additionalProperties": true
    },
    "testing": {
      "type": "object",
      "properties": {
        "unitTests": {
          "type": "boolean"
        },
        "integrationTests": {
          "type": "boolean"
        },
        "e2eTests": {
          "type": "boolean"
        },
        "coverageThreshold": {
          "type": "number",
          "minimum": 0
        },
        "mockData": {
          "type": "boolean"
        },
        "testEnvironments": {
          "type": "array",
          "items": {
            "type": "string",
            "minLength": 1
          },
          "minItems": 0
        }
      },
      "additionalProperties": true
    },
    "deployment": {
      "type": "object",
      "properties": {
        "buildTarget": {
          "type": "string",
          "minLength": 1
        },
        "moduleFormat": {
          "type": "string",
          "minLength": 1
        },
        "bundleSize": {
          "type": "object",
          "properties": {
            "target": {
              "type": "string",
              "minLength": 1
            },
            "warning": {
              "type": "string",
              "minLength": 1
            },
            "error": {
              "type": "string",
              "minLength": 1
            }
          },
          "additionalProperties": true
        },
        "compatibility": {
          "type": "object",
          "properties": {
            "browsers": {
              "type": "array",
              "items": {
                "type": "string",
                "minLength": 1
              },
              "minItems": 0
            },
            "node": {
              "type": "string",
              "minLength": 1
            }
          },
          "additionalProperties": true
        }
      },
      "additionalProperties": true
    }
  },
  "required": [
    "component",
    "ui",
    "data",
    "security",
    "performance",
    "accessibility",
    "i18n",
    "testing",
    "deployment"
  ],
  "additionalProperties": false
}
