{
  "component": {
    "name": "realtimeSensors",
    "displayName": "Realtime Sensors Monitor",
    "version": "0.1.0",
    "description": "Advanced real-time industrial sensor monitoring dashboard with data recording, alerts, and export capabilities",
    "author": "1001.mask.services Development Team",
    "category": "monitoring",
    "tags": ["sensors", "realtime", "monitoring", "industrial", "alerts", "data-export"],
    "dependencies": {
      "vue": "^3.0.0",
      "securityService": "^1.0.0",
      "i18nService": "^1.0.0"
    },
    "permissions": ["sensor_read", "data_export", "system_monitoring"],
    "roles": ["OPERATOR", "ADMIN", "SUPERUSER", "SERWISANT"]
  },
  "ui": {
    "responsive": {
      "breakpoints": {
        "mobile": "480px",
        "tablet": "768px", 
        "desktop": "1024px",
        "industrial_79": "1280x400"
      },
      "layout": "grid-adaptive",
      "orientation": "landscape-optimized"
    },
    "display": {
      "primaryColor": "#42b883",
      "backgroundGradient": "linear-gradient(135deg, #1e3c72 0%, #2a5298 100%)",
      "cardShadow": "0 2px 8px rgba(0,0,0,0.1)",
      "borderRadius": "8px",
      "fontFamily": "'Segoe UI', Tahoma, Geneva, Verdana, sans-serif"
    },
    "animation": {
      "enableTransitions": true,
      "pulseAnimation": "pulse 1s infinite",
      "hoverEffects": true,
      "alertBlink": "alertBlink 2s infinite"
    },
    "touch": {
      "minTouchTarget": "44px",
      "swipeEnabled": false,
      "hapticFeedback": true
    }
  },
  "data": {
    "defaults": {
      "refreshRate": 500,
      "alertsEnabled": true,
      "recordingEnabled": false,
      "maxHistoryPoints": 500,
      "sensorCount": 6
    },
    "sensors": {
      "defaultTypes": ["pressure", "flow_rate", "resistance", "leak_rate", "co2_level", "particle_count"],
      "statusLevels": ["normal", "warning", "critical"],
      "trendTypes": ["stable", "rising", "falling"],
      "refreshRates": [100, 250, 500, 1000, 2000]
    },
    "validation": {
      "valueRange": {
        "min": -1000,
        "max": 100000
      },
      "refreshRateRange": {
        "min": 100,
        "max": 10000
      }
    }
  },
  "security": {
    "auditEvents": [
      "REALTIME_SENSORS_INIT",
      "REALTIME_SENSORS_MONITORING_STARTED", 
      "REALTIME_SENSORS_MONITORING_STOPPED",
      "REALTIME_SENSORS_RECORDING_TOGGLED",
      "REALTIME_SENSORS_DATA_EXPORT",
      "REALTIME_SENSORS_ALERT",
      "REALTIME_SENSORS_CLEANUP"
    ],
    "inputSanitization": true,
    "dataValidation": true,
    "sessionTracking": true,
    "exportLimits": {
      "maxExportSize": "10MB",
      "dailyExportLimit": 50
    }
  },
  "performance": {
    "caching": {
      "enabled": true,
      "cacheDuration": 300000,
      "maxCacheSize": "5MB"
    },
    "optimization": {
      "lazyLoading": true,
      "componentBundling": true,
      "assetOptimization": true
    },
    "monitoring": {
      "memoryUsage": true,
      "renderTime": true,
      "updateFrequency": true
    }
  },
  "accessibility": {
    "ariaLabels": true,
    "keyboardNavigation": true,
    "screenReaderSupport": true,
    "highContrast": true,
    "focusManagement": true,
    "semanticElements": true
  },
  "i18n": {
    "defaultLanguage": "pl",
    "supportedLanguages": ["pl", "en", "de"],
    "translationKeys": {
      "title": "sensors.realtime_title",
      "controls": "sensors.controls",
      "status": "sensors.status", 
      "alerts": "sensors.alerts",
      "export": "sensors.export",
      "recording": "sensors.recording"
    },
    "dateTimeFormat": {
      "pl": "DD.MM.YYYY HH:mm:ss",
      "en": "MM/DD/YYYY HH:mm:ss", 
      "de": "DD.MM.YYYY HH:mm:ss"
    }
  },
  "testing": {
    "unitTests": true,
    "integrationTests": true,
    "e2eTests": false,
    "coverageThreshold": 90,
    "mockData": true,
    "testEnvironments": ["jsdom", "happy-dom"]
  },
  "deployment": {
    "buildTarget": "es2020",
    "moduleFormat": "esm",
    "bundleSize": {
      "target": "50KB",
      "warning": "75KB",
      "error": "100KB"
    },
    "compatibility": {
      "browsers": ["Chrome >= 88", "Firefox >= 78", "Safari >= 14", "Edge >= 88"],
      "node": ">=16.0.0"
    }
  }
}
